{
  "schemaVersion": "1.0",
  "workId": "looking-backward",
  "level": "c1",
  "chapter": {
    "id": "chapter-001",
    "number": 1,
    "title": "El hombre de dos épocas"
  },
  "paragraphs": [
    {
      "id": "para-001",
      "sentences": [
        {
          "id": "sent-001",
          "text": "Nací en la ciudad de Boston en el año 1857, un tiempo que los historiadores consideran remoto y casi fabuloso.",
          "translationRu": "Я родился в городе Бостон в 1857 году, в период, который историки считают отдалённым и почти легендарным."
        },
        {
          "id": "sent-002",
          "text": "Mi situación social era privilegiada: mi familia disfrutaba de una riqueza considerable que había acumulado mi bisabuelo, permitiéndome vivir sin necesidad de trabajar.",
          "translationRu": "Моё общественное положение было привилегированным: моя семья имела значительное богатство, накопленное моим прапрадедом, что позволяло мне жить, не нуждаясь в работе."
        },
        {
          "id": "sent-003",
          "text": "Mi vida consistía únicamente en el disfrute de placeres refinados y en la persecución de la ociosidad cómoda que mi herencia facilitaba.",
          "translationRu": "Моя жизнь состояла исключительно из наслаждения утончёнными удовольствиями и преследования удобного безделья, которое облегчало мне моё наследство."
        },
        {
          "id": "sent-004",
          "text": "Para comprender la naturaleza de aquella sociedad primitiva, es necesario imaginarse la civilización del siglo diecinueve como un gran carruaje que la masa de la humanidad arrastraba con esfuerzo mientras unos pocos privilegiados se mecían cómodamente en los asientos superiores.",
          "translationRu": "Чтобы понять природу того примитивного общества, необходимо представить цивилизацию девятнадцатого века как большую карету, которую масса человечества волокла с трудом, пока несколько привилегированных люде спокойно раскачивались в верхних сиденьях."
        },
        {
          "id": "sent-005",
          "text": "El hambre era el auriga que sin piedad conducía este vehículo, obligando a los desdichados tirones a una marcha lenta y penosa.",
          "translationRu": "Голод был возничим, который без жалости направлял этот экипаж, заставляя несчастных грузчиков идти медленным и мучительным шагом."
        },
        {
          "id": "sent-006",
          "text": "Aunque parezca increíble a los hombres de la época moderna, la mayoría de mis contemporáneos creía sinceramente que este orden injusto era inmutable, que no había otra manera de organizar la sociedad.",
          "translationRu": "Хотя это кажется невероятным людям современной эпохи, большинство моих современников искренне верили, что этот несправедливый порядок неизменен, что не было другого способа организовать общество."
        },
        {
          "id": "sent-007",
          "text": "Los más ricos creían que habían sido elegidos por la Providencia para ocupar sus cómodos puestos, mientras que los pobres aceptaban su destino como un castigo divino.",
          "translationRu": "Самые богатые верили, что были избраны Провидением, чтобы занять свои удобные должности, в то время как бедные принимали свою судьбу как божественное наказание."
        },
        {
          "id": "sent-008",
          "text": "En 1887, cuando cumplí treinta años, aún no había indicios visibles del cambio colosal que vendría en el siguiente siglo.",
          "translationRu": "В 1887 году, когда мне исполнилось тридцать лет, ещё не было видимых признаков огромных перемен, которые произойдут в следующем столетии."
        },
        {
          "id": "sent-009",
          "text": "Estaba comprometido para casarme con Edith Bartlett, una joven hermosa y refinada de la clase acomodada, cuando los disturbios laborales y las huelgas retrasaron indefinidamente la conclusión de mi futura vivienda.",
          "translationRu": "Я был помолвлен с Эдит Бартлетт, красивой и утонченной девушкой состоятельного класса, когда трудовые беспорядки и забастовки неопределённо отложили завершение моего будущего дома."
        },
        {
          "id": "sent-010",
          "text": "Padecía de insomnio crónico, un mal que afligía a muchos hombres de mi época, y para dormir utilizaba los servicios de un mesmerizador llamado Dr. Pillsbury.",
          "translationRu": "Я страдал от хронической бессонницы, недуга, который мучил многих мужчин моей эпохи, и для сна я использовал услуги месмеризера по имени доктор Пиллсбери."
        },
        {
          "id": "sent-011",
          "text": "Este mesmerizador, mediante manipulaciones magnéticas de poderes desconocidos, era capaz de sumergirme en un profundo sueño del cual me despertaba únicamente cuando su voluntad lo decidía.",
          "translationRu": "Этот месмеризер, посредством магнитных манипуляций неизвестной силы, был способен погрузить меня в глубокий сон, из которого я пробуждался только по его решению."
        },
        {
          "id": "sent-012",
          "text": "La noche del 30 de mayo de 1887, después de visitar a Edith y sus padres en el cementerio de Mount Auburn, regresé a casa profundamente irritado por las nuevas noticias de huelgas.",
          "translationRu": "В ночь 30 мая 1887 года, после посещения Эдит и её родителей на кладбище Mount Auburn, я вернулся домой, глубоко раздражённый новостями о новых забастовках."
        },
        {
          "id": "sent-013",
          "text": "Estas huelgas amenazaban con retrasar aún más mi matrimonio, el cual era prácticamente lo único que podía despertar mi interés en una sociedad que de otro modo me parecía soportable.",
          "translationRu": "Эти забастовки грозили ещё больше отложить мой брак, который был практически единственным, что могло пробудить мой интерес в обществе, которое в противном случае казалось мне сносным."
        },
        {
          "id": "sent-014",
          "text": "Solicité nuevamente los servicios del Dr. Pillsbury para conseguir dormir, y me recosté en mi cámara subterránea construida especialmente para evitar los ruidos de la ciudad.",
          "translationRu": "Я снова попросил услуги доктора Пиллсбери, чтобы заснуть, и лёг в своей подземной камере, специально построенной, чтобы избежать городских шумов."
        },
        {
          "id": "sent-015",
          "text": "Esta cámara era un refugio hermético, aislado del mundo exterior, con paredes de cemento hidráulico y una puerta de hierro reforzada con asbesto.",
          "translationRu": "Эта камера была герметичным убежищем, изолированным от внешнего мира, со стенами из гидравлического цемента и усиленной асбестом железной дверью."
        },
        {
          "id": "sent-016",
          "text": "Mientras el mesmerizador realizaba sus manipulaciones, sentía que la somnolencia me envolvía como una ola deliciosa, y pronto caí en un sueño tan profundo que perdería la conciencia de todo lo demás durante más de un siglo.",
          "translationRu": "Пока месмеризер проводил свои манипуляции, я чувствовал, как сонливость охватывает меня, словно восхитительная волна, и вскоре я упал в такой глубокий сон, что потеряю сознание всего остального более чем на столетие."
        },
        {
          "id": "sent-017",
          "text": "Mi prometida Edith nunca supo lo que había sucedido conmigo aquella noche, así como sus descendientes también ignorarían el destino de su antepasado durante generaciones.",
          "translationRu": "Моя невеста Эдит никогда не узнала, что со мной произошло той ночью, и её потомки в течение поколений также не будут знать о судьбе своего предка."
        },
        {
          "id": "sent-018",
          "text": "Cuando finalmente despertara, sería en un mundo tan radicalmente transformado que parecería casi un sueño mismo, pero más vívido y real que cualquier fantasía que pueda atormentar a la mente dormida.",
          "translationRu": "Когда я наконец пробудился бы, это было бы в мире столь радикально преобразованном, что казался бы почти самим сном, но более ярким и реальным, чем любая фантазия, которая может мучить спящий ум."
        },
        {
          "id": "sent-019",
          "text": "La historia de mi sueño prolongado sería contada por mis propios ojos como testigo, no como ficción de un escritor imaginativo, sino como la verdadera crónica de un hombre que durmió en el siglo diecinueve y despertó en el veinte.",
          "translationRu": "История моего продолжительного сна будет рассказана моими собственными глазами свидетеля, не как вымысел воображаемого писателя, а как истинная хроника человека, который спал в девятнадцатом веке и пробудился в двадцатом."
        },
        {
          "id": "sent-020",
          "text": "Pero en aquella última noche del siglo diecinueve que viví conscientemente, yo aún ignoraba completamente la asombrosa aventura que me aguardaba en el futuro, y me dormía como un hombre que espera despertar de nuevo en la cámara que siempre había sido mi refugio.",
          "translationRu": "Но в ту последнюю ночь девятнадцатого века, которую я сознательно прожил, я полностью не знал об удивительном приключении, которое меня ждало в будущем, и засыпал как человек, ожидающий снова пробудиться в камере, которая всегда была моим убежищем."
        }
      ]
    }
  ]
}
