{
  "schemaVersion": "1.0",
  "workId": "the-prisoner-of-zenda",
  "level": "a2",
  "chapter": {
    "id": "chapter-003",
    "number": 3,
    "title": "El rey en el castillo"
  },
  "paragraphs": [
    {
      "id": "para-001",
      "sentences": [
        {
          "id": "sent-001",
          "text": "Esa noche volvimos al bosque para buscar al rey, pero no estaba en la casa de caza.",
          "translationRu": "Той ночью мы вернулись в лес, чтобы найти короля, но его не было в охотничьем домике."
        },
        {
          "id": "sent-002",
          "text": "En la bodega encontramos el cuerpo del sirviente Josef: lo habían matado.",
          "translationRu": "В подвале мы нашли тело слуги Йозефа: его убили."
        },
        {
          "id": "sent-003",
          "text": "El rey no estaba allí; el duque Miguel se lo había llevado al castillo de Zenda.",
          "translationRu": "Короля там не было; герцог Михаил увёз его в замок Зенда."
        }
      ]
    },
    {
      "id": "para-002",
      "sentences": [
        {
          "id": "sent-004",
          "text": "Sapt decidió que yo tenía que seguir siendo el rey en Strelsau.",
          "translationRu": "Сапт решил, что я должен продолжать быть королём в Стрелсау."
        },
        {
          "id": "sent-005",
          "text": "Era la única manera de salvar al rey verdadero.",
          "translationRu": "Это был единственный способ спасти настоящего короля."
        },
        {
          "id": "sent-006",
          "text": "En Strelsau vivía como rey todos los días.",
          "translationRu": "В Стрелсау я жил как король каждый день."
        },
        {
          "id": "sent-007",
          "text": "La princesa Flavia me visitaba con frecuencia y yo me enamoré de ella.",
          "translationRu": "Принцесса Флавия часто навещала меня, и я влюбился в неё."
        }
      ]
    },
    {
      "id": "para-003",
      "sentences": [
        {
          "id": "sent-008",
          "text": "Un día recibí una carta de una mujer.",
          "translationRu": "Однажды я получил письмо от женщины."
        },
        {
          "id": "sent-009",
          "text": "Era Antoinette de Mauban, la dama del tren.",
          "translationRu": "Это была Антуанетта де Мобан, та самая дама из поезда."
        },
        {
          "id": "sent-010",
          "text": "Me invitaba a una casa por la noche para contarme algo importante.",
          "translationRu": "Она приглашала меня ночью в один дом, чтобы рассказать что-то важное."
        },
        {
          "id": "sent-011",
          "text": "Fui solo a verla, con un revólver en el bolsillo.",
          "translationRu": "Я пошёл к ней один, с револьвером в кармане."
        }
      ]
    },
    {
      "id": "para-004",
      "sentences": [
        {
          "id": "sent-012",
          "text": "Antoinette me dijo que el duque mandó la carta para atraerme a una trampa.",
          "translationRu": "Антуанетта сказала мне, что герцог написал письмо, чтобы заманить меня в ловушку."
        },
        {
          "id": "sent-013",
          "text": "Tres hombres querían matarme esa noche.",
          "translationRu": "Три человека хотели убить меня той ночью."
        },
        {
          "id": "sent-014",
          "text": "Usé una mesa de hierro para defenderse de los tres hombres y escapé.",
          "translationRu": "Я использовал железный стол, чтобы защититься от трёх мужчин, и убежал."
        },
        {
          "id": "sent-015",
          "text": "Sapt me esperaba fuera con los caballos.",
          "translationRu": "Сапт ждал меня снаружи с лошадьми."
        },
        {
          "id": "sent-016",
          "text": "Los tres hombres eran sirvientes del duque Miguel.",
          "translationRu": "Эти трое мужчин были слугами герцога Михаила."
        },
        {
          "id": "sent-017",
          "text": "Ahora sabía que mi vida estaba en peligro cada día.",
          "translationRu": "Теперь я знал, что моя жизнь каждый день была в опасности."
        }
      ]
    }
  ]
}
