{"schemaVersion":"1.0","workId":"the-coming-race","level":"b2","chapter":{"id":"chapter-005","number":5,"title":"El regreso a la luz"},"paragraphs":[{"id":"para-001","sentences":[{"id":"sent-001","text":"El Tur había ordenado mi ejecución por medio de su hijo, quien debería convertirme en cenizas sin piedad.","translationRu":"Тур приказал мою казнь через своего сына, который должен был обратить меня в пепел без сострадания."},{"id":"sent-002","text":"Taee, aunque devoto de su padre, sintió la obligación de avisarme del terrible decreto que pendía sobre mi vida.","translationRu":"Таи, хотя преданный отцу, почувствовал необходимость предупредить меня об ужасном приговоре, нависшем над моей жизнью."},{"id":"sent-003","text":"Pero la grieta por la cual había descendido ya había sido sellada permanentemente por orden de Aph-Lin.","translationRu":"Но расселина, через которую я спустился, уже была навсегда запечатана по приказу Аф-Лина."},{"id":"sent-004","text":"No había escapatoria por las vías conocidas, y el mundo subterráneo se había convertido en mi prisión inevitable.","translationRu":"Не было пути спасения через известные маршруты, и подземный мир стал моей неизбежной тюрьмой."},{"id":"sent-005","text":"Zee, enterada del destino que me aguardaba, tomó una decisión que cambió todo: me ofrecería su salvación.","translationRu":"Зи, узнав о судьбе, ждавшей меня, приняла решение, которое изменило всё: предложила мне спасение."},{"id":"sent-006","text":"Durante las horas silenciosas, cuando toda la ciudad dormía profundamente, ella me condujo hacia la grieta.","translationRu":"Во время молчаливых часов, когда весь город спал глубоко, она повела меня к расселине."},{"id":"sent-007","text":"Con los poderes extraordinarios del Vril, abrió un nuevo camino a través de las rocas, creando una vía de escape.","translationRu":"Необычайными силами Вриля она открыла новый путь сквозь скалы, создав путь спасения."},{"id":"sent-008","text":"Su hermosa cara, iluminada por el diadema de gemas en su frente, brillaba con una luz de sacrificio.","translationRu":"Её прекрасное лицо, освещённое диадемой драгоценностей на лбу, сияло светом жертвы."},{"id":"sent-009","text":"Me abrazó por primera y única vez, permitiendo que me sostuviera mientras extendía sus alas gigantescas.","translationRu":"Она обняла меня в первый и последний раз, позволяя мне держаться, пока она расправляла свои гигантские крылья."},{"id":"sent-010","text":"Nos elevamos a través de la oscuridad, guiados por la luz de su corona que brillaba como una lluvia de estrellas.","translationRu":"Мы поднялись сквозь тьму, направляемые светом её корон ы, сияющей как звёздный дождь."},{"id":"sent-011","text":"Conforme ascendía, escuchaba los sonidos de la civilización subterránea desvanecerse, reemplazados por ecos vacios.","translationRu":"Когда я поднимался, я слышал, как звуки подземной цивилизации угасали, заменённые пустыми эхо."},{"id":"sent-012","text":"Finalmente, alcanzamos la galería de la mina donde laboraban mineros en sus faenas diarias y cotidianas.","translationRu":"Наконец мы достигли галереи шахты, где работали шахтёры в своих ежедневных трудах."},{"id":"sent-013","text":"Zee me besó en la frente con pasión maternal y me dijo palabras de despedida que nunca olvidaré.","translationRu":"Зи поцеловала меня в лоб с материнской страстью и произнесла слова прощания, которые я никогда не забуду."},{"id":"sent-014","text":"\"Aunque estemos separados en esta vida, nos encontraremos en la siguiente\", susurró mientras sus alas se alejaban hacia la oscuridad.","translationRu":"\"Хотя мы разделены в этой жизни, мы встретимся в следующей\", прошептала она, пока её крылья удалялись в темноту."},{"id":"sent-015","text":"Regresé lentamente a la mina, siendo observado con curiosidad por los mineros que desconocían mi origen extraordinario.","translationRu":"Я медленно вернулся в шахту, наблюдаемый с любопытством шахтёрами, которые не знали о моём необычном происхождении."},{"id":"sent-016","text":"Escapé de aquella región sin ser detenido, y en pocos días había dejado atrás toda evidencia de mi aventura.","translationRu":"Я бежал из того региона без задержания, и в считанные дни оставил позади всё доказательство моего приключения."},{"id":"sent-017","text":"Desde entonces, he vivido una vida tranquila y ordinaria, pero nunca he dejado de pensar en aquella raza extraordinaria.","translationRu":"С тех пор я жил спокойной и обычной жизнью, но никогда не переставал думать об той необычной расе."},{"id":"sent-018","text":"A menudo me pregunto si la profecía que escuché es verdadera: ¿emergirán algún día los Vril-ya en la superficie?","translationRu":"Я часто задаю себе вопрос, правда ли пророчество, которое я услышал: появятся ли когда-нибудь Виль-йа на поверхности?"},{"id":"sent-019","text":"Si es así, su superior poder y moral destruirían completamente nuestras civilizaciones imperfectas.","translationRu":"Если это так, их превосходящая мощь и нравственность полностью разрушат наши несовершенные цивилизации."},{"id":"sent-020","text":"Dejo este testimonio como advertencia y como testimonio del extraordinario mundo que existe bajo nuestros pies.","translationRu":"Я оставляю это свидетельство в качестве предупреждения и свидетельства необычайного мира, существующего под нашими ногами."},{"id":"sent-021","text":"Aunque nunca podré retornar a ese mundo, su memoria permanecerá conmigo hasta el fin de mis días.","translationRu":"Хотя я никогда не смогу вернуться в тот мир, его память останется со мною до конца моих дней."},{"id":"sent-022","text":"La raza futura realmente existe, esperando el momento en que el destino permita su encuentro inevitable con la humanidad.","translationRu":"Раса будущего действительно существует, ожидая момента, когда судьба позволит её неизбежную встречу с человечеством."}]}]}
