{
  "schemaVersion": "1.0",
  "workId": "jane-eyre",
  "level": "c1",
  "chapter": {
    "id": "chapter-002",
    "number": 2,
    "title": "Lowood: primeras lecciones"
  },
  "paragraphs": [
    {
      "id": "para-001",
      "sentences": [
        {
          "id": "sent-001",
          "text": "Lowood era una institución educativa austero, un lugar donde el trabajo y la disciplina prevalecían sobre el confort y la calidez humana.",
          "translationRu": "Лоувод был суровым образовательным учреждением, местом, где работа и дисциплина преобладали над комфортом и человеческой теплотой."
        },
        {
          "id": "sent-002",
          "text": "Jane llegó en invierno, cuando el frío penetrante y la nieve cubrían los terrenos de la escuela, creando una atmósfera de desolación.",
          "translationRu": "Джейн прибыла зимой, когда пронизывающий холод и снег покрывали территорию школы, создавая атмосферу запустения."
        },
        {
          "id": "sent-003",
          "text": "Las maestras eran severas, el director del colegio, el señor Brocklehurst, era un hombre rígido y mojigato que predicaba la mortificación del cuerpo.",
          "translationRu": "Учительницы были суровыми, директор школы, мистер Брокклхёрст, был жёстким и ханжеским человеком, проповедовавшим умерщвление плоти."
        },
        {
          "id": "sent-004",
          "text": "Las comidas eran escasas y a menudo inaceptables, las habitaciones sin calefacción, y los castigos eran arbitrarios y frecuentes.",
          "translationRu": "Пищи было мало и часто она была неприемлемой, комнаты без отопления, и наказания были произвольными и частыми."
        },
        {
          "id": "sent-005",
          "text": "Entre las alumnas, Jane conoció a Helen Burns, una muchacha mayor de temperamento sereno y profunda fe religiosa.",
          "translationRu": "Среди ученниц Джейн познакомилась с Хелен Бёрнс, девушкой старше, спокойного нрава и глубокой религиозной веры."
        },
        {
          "id": "sent-006",
          "text": "Helen soportaba los castigos injustos con una paciencia que Jane no podía comprender, citando la doctrina cristiana del perdón.",
          "translationRu": "Хелен переносила несправедливые наказания с терпением, которое Джейн не могла понять, ссылаясь на христианскую доктрину прощения."
        },
        {
          "id": "sent-007",
          "text": "A pesar de sus diferencias filosóficas, las dos muchachas desarrollaron una amistad profunda que proporcionaba consuelo en aquel lugar de sufrimiento.",
          "translationRu": "Несмотря на философические различия, две девушки развили глубокую дружбу, которая утешала в том месте страдания."
        },
        {
          "id": "sent-008",
          "text": "El señor Brocklehurst visitó Lowood y Jane fue expuesta públicamente como mentirosa, acusación que la hizo sufrir intensamente.",
          "translationRu": "Мистер Брокклхёрст посетил Лоувод, и Джейн была публично разоблачена как лжец, обвинение, которое заставило её страдать интенсивно."
        },
        {
          "id": "sent-009",
          "text": "La compasión de Helen y el apoyo de su maestra, la señorita Temple, permitieron a Jane comenzar a reconstruir su autoestima dañada.",
          "translationRu": "Сострадание Хелен и поддержка её учительницы, мисс Темпл, позволили Джейн начать восстанавливать свою повреждённую самооценку."
        },
        {
          "id": "sent-010",
          "text": "Jane trabajó incansablemente en sus estudios, probando su inteligencia e inocencia mediante el esfuerzo y la excelencia académica.",
          "translationRu": "Джейн работала неустанно в своих учебных занятиях, доказывая свой интеллект и невиновность через усилие и академическое совершенство."
        },
        {
          "id": "sent-011",
          "text": "Eventualmente fue exonerada públicamente cuando el señor Lloyd confirmó que sus acusaciones había sido infundadas.",
          "translationRu": "В конце концов она была публично оправдана, когда мистер Ллойд подтвердил, что обвинения были необоснованными."
        },
        {
          "id": "sent-012",
          "text": "Después de esto, Jane se convirtió en una estudiante exemplar, enseñando a niños más jóvenes y ganándose el afecto de la señorita Temple.",
          "translationRu": "После этого Джейн стала примерной ученицей, преподавая младшим детям и завоёвывая привязанность мисс Темпл."
        },
        {
          "id": "sent-013",
          "text": "Sin embargo, la primavera trajo una epidemia de tifus que golpeó la escuela con crueldad.",
          "translationRu": "Однако весна принесла эпидемию тифа, которая жестоко поразила школу."
        },
        {
          "id": "sent-014",
          "text": "Cuarenta y cinco de las ochenta alumnas enfermaron gravemente, y muchas no sobrevivieron a la enfermedad.",
          "translationRu": "Сорок пять из восьмидесяти учениц заболели тяжело, и многие не пережили болезнь."
        },
        {
          "id": "sent-015",
          "text": "Helen Burns fue una de las víctimas, pero su muerte fue tranquila, rodeada del cuidado de la señorita Temple.",
          "translationRu": "Хелен Бёрнс была одной из жертв, но её смерть была спокойной, окружённой заботой мисс Темпл."
        },
        {
          "id": "sent-016",
          "text": "Jane pasó sus últimas horas con Helen, recibiendo consuelo de su amiga en el momento más doloroso.",
          "translationRu": "Джейн провела свои последние часы с Хелен, получая утешение от своей подруги в самый болезненный момент."
        },
        {
          "id": "sent-017",
          "text": "La muerte de Helen, aunque inevitable, dejó una herida profunda en el corazón de Jane.",
          "translationRu": "Смерть Хелен, хотя неизбежна, оставила глубокую рану в сердце Джейн."
        },
        {
          "id": "sent-018",
          "text": "Los años siguientes en Lowood fueron productivos: Jane se convirtió en maestra, disfrutando de mayor autonomía y respeto.",
          "translationRu": "Следующие годы в Лоувуде были продуктивными: Джейн стала учительницей, наслаждаясь большей автономией и уважением."
        },
        {
          "id": "sent-019",
          "text": "Pero después de seis años en la institución, Jane sintió el deseo de experimentar una vida nueva fuera de aquellos muros sombríos.",
          "translationRu": "Но после шести лет в учреждении Джейн почувствовала желание испытать новую жизнь вне тех мрачных стен."
        },
        {
          "id": "sent-020",
          "text": "Colocó un anuncio como gobernanta en los periódicos, decidida a buscar su propia fortuna en el mundo exterior.",
          "translationRu": "Она разместила объявление о работе гувернантки в газетах, решив искать свою собственную судьбу во внешнем мире."
        },
        {
          "id": "sent-021",
          "text": "Al partir de Lowood, Jane llevaba consigo las lecciones aprendidas, el recuerdo de Helen, y la esperanza de un futuro diferente.",
          "translationRu": "Уходя из Лоувода, Джейн несла с собой выученные уроки, память о Хелен и надежду на другое будущее."
        }
      ]
    }
  ]
}
