{
  "schemaVersion": "1.0",
  "workId": "the-jungle-book",
  "level": "a2",
  "chapter": {
    "id": "chapter-004",
    "number": 4,
    "title": "Rikki-Tikki-Tavi"
  },
  "paragraphs": [
    {
      "id": "para-001",
      "sentences": [
        {
          "id": "sent-001",
          "text": "Una vez, una gran lluvia sacó a una mangosta de su casa.",
          "translationRu": "Однажды большой дождь вымыл мангуста из его норы."
        },
        {
          "id": "sent-002",
          "text": "Una familia inglesa encontró al pequeño animal y lo llevó a su casa.",
          "translationRu": "Английская семья нашла маленького зверька и принесла его домой."
        },
        {
          "id": "sent-003",
          "text": "Le dieron comida y lo llamaron Rikki-Tikki-Tavi.",
          "translationRu": "Они накормили его и назвали Рикки-Тикки-Тави."
        },
        {
          "id": "sent-004",
          "text": "Rikki era curioso y valiente. Pronto exploró toda la casa y el jardín.",
          "translationRu": "Рикки был любопытен и смел. Вскоре он исследовал весь дом и сад."
        }
      ]
    },
    {
      "id": "para-002",
      "sentences": [
        {
          "id": "sent-005",
          "text": "En el jardín vivían dos cobras peligrosas: Nag y su esposa Nagaina.",
          "translationRu": "В саду жили две опасные кобры: Наг и его жена Нагайна."
        },
        {
          "id": "sent-006",
          "text": "Las cobras querían matar a la familia para tener el jardín para ellas.",
          "translationRu": "Кобры хотели убить семью, чтобы иметь сад только для себя."
        },
        {
          "id": "sent-007",
          "text": "Rikki escuchó el plan de Nag y Nagaina por la noche.",
          "translationRu": "Рикки подслушал план Нага и Нагайны ночью."
        },
        {
          "id": "sent-008",
          "text": "Nag entró en el baño de la casa para esperar al padre de la familia.",
          "translationRu": "Наг вошёл в ванную комнату дома, чтобы поджидать отца семейства."
        }
      ]
    },
    {
      "id": "para-003",
      "sentences": [
        {
          "id": "sent-009",
          "text": "Rikki saltó sobre Nag y lo mordió en la cabeza. No lo soltó.",
          "translationRu": "Рикки прыгнул на Нага и укусил его за голову. Он не отпускал."
        },
        {
          "id": "sent-010",
          "text": "El padre oyó el ruido y disparó su escopeta. Nag estaba muerto.",
          "translationRu": "Отец услышал шум и выстрелил из ружья. Наг был мёртв."
        },
        {
          "id": "sent-011",
          "text": "Al día siguiente, Rikki fue al jardín a buscar los huevos de Nagaina.",
          "translationRu": "На следующий день Рикки пошёл в сад искать яйца Нагайны."
        },
        {
          "id": "sent-012",
          "text": "Encontró los huevos cerca de la pared y los destruyó uno por uno.",
          "translationRu": "Он нашёл яйца у стены и уничтожил их одно за другим."
        }
      ]
    },
    {
      "id": "para-004",
      "sentences": [
        {
          "id": "sent-013",
          "text": "Nagaina fue a la terraza y amenazó al niño Teddy y a su familia.",
          "translationRu": "Нагайна пришла на веранду и угрожала мальчику Тедди и его семье."
        },
        {
          "id": "sent-014",
          "text": "Rikki llegó con el último huevo y distrajo a la cobra.",
          "translationRu": "Рикки прибежал с последним яйцом и отвлёк кобру."
        },
        {
          "id": "sent-015",
          "text": "Nagaina corrió a su agujero, pero Rikki la siguió hasta dentro.",
          "translationRu": "Нагайна побежала к своей норе, но Рикки последовал за ней внутрь."
        },
        {
          "id": "sent-016",
          "text": "Rikki salió solo. Nagaina estaba muerta. El jardín estaba seguro.",
          "translationRu": "Рикки вышел один. Нагайна была мертва. Сад был в безопасности."
        },
        {
          "id": "sent-017",
          "text": "La familia abrazó a la valiente mangosta. Rikki guardó el jardín para siempre.",
          "translationRu": "Семья обняла храброго мангуста. Рикки охранял сад всегда."
        }
      ]
    }
  ]
}
