{
  "schemaVersion": "1.0",
  "workId": "the-gods-of-mars",
  "level": "b2",
  "chapter": {
    "id": "chapter-006",
    "number": 6,
    "title": "La verdad sobre los dioses"
  },
  "paragraphs": [
    {
      "id": "para-001",
      "sentences": [
        {
          "id": "sent-001",
          "text": "Carter finalmente llegó al templo central de Issus, donde se revelaban los secretos más antiguos de Barsoom.",
          "translationRu": "Картер наконец прибыл в центральный храм Иссуса, где раскрывались самые древние тайны Барсума."
        },
        {
          "id": "sent-002",
          "text": "En una cámara oscura y cavernosa, vio la figura de la diosa Issus sentada en un trono de oro puro.",
          "translationRu": "В тёмной обширной камере он увидел фигуру богини Иссуса, сидящей на троне из чистого золота."
        },
        {
          "id": "sent-003",
          "text": "Pero cuando se acercó más, comprendió la verdad terrible: Issus no era una diosa, sino una mujer mortal que había vivido durante siglos.",
          "translationRu": "Но когда он подошёл ближе, он понял ужасную правду: Иссус была не богиней, а смертной женщиной, жившей веками."
        },
        {
          "id": "sent-004",
          "text": "Los Therns, una antigua raza de sacerdotes, la habían mantenido viva mediante tecnología avanzada y drogas secretas.",
          "translationRu": "Терны, древняя раса жрецов, держали её живой благодаря передовой технологии и тайным наркотикам."
        },
        {
          "id": "sent-005",
          "text": "Toda la religión de Barsoom se basaba en una mentira elaborada para controlar a las masas.",
          "translationRu": "Вся религия Барсума была основана на тщательно спланированной лжи для контроля масс."
        },
        {
          "id": "sent-006",
          "text": "Dejah Thoris no estaba en el templo, pero Carter descubrió documentos que indicaban dónde podría estar.",
          "translationRu": "Деджа Торис не была в храме, но Картер обнаружил документы, указывающие на то, где она могла быть."
        },
        {
          "id": "sent-007",
          "text": "Aparentemente, había sido llevada a una isla-prisión llamada Shador, ubicada en el centro del gran lago subterráneo.",
          "translationRu": "Видимо, её доставили на остров-тюрьму под названием Шадор, расположенный в центре большого подземного озера."
        },
        {
          "id": "sent-008",
          "text": "Carter se enfrentó directamente con Issus, revelándole que su verdadera identidad era conocida.",
          "translationRu": "Картер столкнулся с Иссусом напрямую, раскрыв ей, что его истинная личность известна."
        },
        {
          "id": "sent-009",
          "text": "La mujer hizo sonar alarmas, y pronto el templo fue invadido por guardianes furiosos que querían capturar a Carter.",
          "translationRu": "Женщина включила тревогу, и вскоре храм был захвачен разъярённые стражи, которые хотели захватить Картера."
        },
        {
          "id": "sent-010",
          "text": "Tars Tarkas y Carter lucharon valientemente contra la avalancha de enemigos, retrocediendo hacia la salida.",
          "translationRu": "Тарс Таркас и Картер отважно сражались против потока врагов, отступая к выходу."
        },
        {
          "id": "sent-011",
          "text": "Aunque fueron superados en número, su experiencia y habilidad les permitieron escapar del templo.",
          "translationRu": "Хотя они были численно превосходили, их опыт и мастерство позволили им бежать из храма."
        },
        {
          "id": "sent-012",
          "text": "Se dirigieron directamente hacia la isla de Shador, sabiendo que allí encontrarían a Dejah Thoris.",
          "translationRu": "Они направились прямо к острову Шадор, зная, что там найдут Деджа Торис."
        },
        {
          "id": "sent-013",
          "text": "La travesía por el lago fue peligrosa, con criaturas enormes y antiguas emergiendo de las profundidades.",
          "translationRu": "Переход через озеро был опасным, с огромными древними существами, появляющимися из глубин."
        },
        {
          "id": "sent-014",
          "text": "Pero Carter y Tars Tarkas no fueron detenidos por nada en su misión de rescate.",
          "translationRu": "Но Картер и Тарс Таркас не были остановлены ничем в своей спасательной миссии."
        },
        {
          "id": "sent-015",
          "text": "Finalmente llegaron a la isla, donde vieron fortalezas guardadas por docenas de soldados enemigos.",
          "translationRu": "Наконец они прибыли на остров, где видели крепости, охраняемые десятками вражеских солдат."
        },
        {
          "id": "sent-016",
          "text": "Pero nada podría impedir que Carter conquistara su fortaleza, ni siquiera un ejército entero.",
          "translationRu": "Но ничто не могло помешать Картеру завоевать эту крепость, даже целая армия."
        },
        {
          "id": "sent-017",
          "text": "Con un último esfuerzo desesperado, penetraron los muros de la prisión y liberaron a todos los cautivos.",
          "translationRu": "В последнем отчаянном усилии они проломили стены тюрьмы и освободили всех пленников."
        },
        {
          "id": "sent-018",
          "text": "Y entre los liberados, Carter vio a su amada Dejah Thoris, intacta y con los ojos brillantes de esperanza.",
          "translationRu": "И среди освобождённых Картер увидел свою любимую Деджа Торис, невредимую и с глазами, сияющими надеждой."
        },
        {
          "id": "sent-019",
          "text": "Abrazo y promesas de regreso a Helium marcaron el final de su increíble aventura en las profundidades del planeta marciano.",
          "translationRu": "Объятия и обещания возвращения в Гелий ознаменовали конец его невероятного приключения в глубинах марсианской планеты."
        }
      ]
    }
  ]
}
