{
  "schemaVersion": "1.0",
  "workId": "journey-to-the-center-of-the-earth",
  "level": "b2",
  "chapter": {
    "id": "chapter-002",
    "number": 2,
    "title": "El guía Hans y el volcán Sneffels"
  },
  "paragraphs": [
    {
      "id": "para-001",
      "sentences": [
        {
          "id": "sent-001",
          "text": "Después de varios días de navegación por aguas cada vez más grises y frías, los viajeros llegaron a Reikiavik, la capital de Islandia.",
          "translationRu": "После нескольких дней плавания по всё более серым и холодным водам путешественники прибыли в Рейкьявик, столицу Исландии."
        },
        {
          "id": "sent-002",
          "text": "La ciudad era un pueblo austero de casas de madera pintadas de colores vivos contra la extensión gris del mar del Norte.",
          "translationRu": "Город был суровым поселением с деревянными домами, выкрашенными в яркие цвета на фоне серых просторов Северного моря."
        },
        {
          "id": "sent-003",
          "text": "El profesor consultó al gobernador y al catedrático local sobre Saknussemm, y descubrió que las obras del alquimista habían sido quemadas en 1573 por orden eclesiástica.",
          "translationRu": "Профессор расспросил губернатора и местного учёного о Сакнуссеме и выяснил, что труды алхимика были сожжены в 1573 году по приказу церкви."
        },
        {
          "id": "sent-004",
          "text": "Sin embargo, el pergamino había sobrevivido oculto en el libro islandés, prueba de que Saknussemm había descifrado el secreto de la Tierra.",
          "translationRu": "Однако пергамент уцелел, скрытый в исландской книге, — доказательство того, что Сакнуссем разгадал тайну Земли."
        }
      ]
    },
    {
      "id": "para-002",
      "sentences": [
        {
          "id": "sent-005",
          "text": "En Reikiavik contrataron a Hans Bjelke, un cazador de patos que también trabajaba como guía y era conocido por su serenidad absoluta en cualquier situación.",
          "translationRu": "В Рейкьявике они наняли Ганса Бьелке, охотника на уток, который также работал проводником и славился своим полным спокойствием в любой ситуации."
        },
        {
          "id": "sent-006",
          "text": "Hans era un hombre rubio de unos cuarenta años, musculoso y silencioso, que aceptó el trabajo con la misma indiferencia con que hubiera aceptado cazar un ánsar.",
          "translationRu": "Ганс был светловолосым мужчиной лет сорока, мускулистым и молчаливым, принявшим работу с тем же безразличием, с каким мог бы согласиться поохотиться на гуся."
        },
        {
          "id": "sent-007",
          "text": "Tres caballos los aguardaban al día siguiente cargados con instrumentos científicos, cuerdas y víveres para el largo viaje hacia el volcán.",
          "translationRu": "На следующий день их ждали три лошади, гружённые научными приборами, верёвками и провизией для долгого пути к вулкану."
        }
      ]
    },
    {
      "id": "para-003",
      "sentences": [
        {
          "id": "sent-008",
          "text": "La travesía a caballo por el interior de Islandia fue dura: el paisaje alternaba entre campos de lava negra, praderas cubiertas de musgo y ríos torrenciales.",
          "translationRu": "Путешествие верхом по внутренним районам Исландии было тяжёлым: пейзаж чередовал поля чёрной лавы, покрытые мхом луга и бурные реки."
        },
        {
          "id": "sent-009",
          "text": "En el pueblo de Stapi, al pie del Sneffels, el rector local los recibió con desconfianza y desaprobó abiertamente la empresa.",
          "translationRu": "В деревне Стапи, у подножия Снайфедльса, местный пастор встретил их с подозрением и открыто осудил их затею."
        },
        {
          "id": "sent-010",
          "text": "Harry contempló por primera vez el Sneffels Yokul: una montaña majestuosa coronada de nieve cuyo cráter dormido se perdía entre las nubes.",
          "translationRu": "Гарри впервые увидел Снайфедльсйёкюдль: величественную гору, увенчанную снегом, чей дремлющий кратер терялся в облаках."
        },
        {
          "id": "sent-011",
          "text": "El volcán llevaba siglos inactivo, pero sus flancos de roca basáltica y sus paredes de cristal negro recordaban el poder que dormía en sus entrañas.",
          "translationRu": "Вулкан был неактивен уже несколько столетий, но его базальтовые склоны и чёрные стекловидные стены напоминали о силе, дремлющей в его недрах."
        }
      ]
    },
    {
      "id": "para-004",
      "sentences": [
        {
          "id": "sent-012",
          "text": "El ascenso al cráter comenzó de madrugada para evitar el calor del mediodía, aunque en Islandia el sol apenas se ocultaba en aquella época del año.",
          "translationRu": "Подъём к кратеру начался на рассвете, чтобы избежать полуденного зноя, хотя в Исландии в ту пору солнце почти не заходило."
        },
        {
          "id": "sent-013",
          "text": "Una repentina tormenta de arena llamada mistour los sorprendió a mitad de la ladera, cegando a los viajeros con rafagas de polvo volcánico.",
          "translationRu": "На середине склона их застал внезапный песчаный бурен под названием мистур, ослепивший путешественников вихрями вулканической пыли."
        },
        {
          "id": "sent-014",
          "text": "Hans encontró refugio bajo una roca saliente y los tres esperaron hasta que la tormenta amainó, revelando de nuevo el camino hacia la cima.",
          "translationRu": "Ганс нашёл убежище под скальным выступом, и все трое ждали, пока буря не стихла, открыв вновь дорогу к вершине."
        },
        {
          "id": "sent-015",
          "text": "Al llegar a la cumbre a medianoche, Harry contempló un espectáculo inolvidable: tres cráteres abiertos en la roca como fauces de titán.",
          "translationRu": "Достигнув вершины в полночь, Гарри увидел незабываемое зрелище: три кратера, открытых в скале, словно пасти титана."
        }
      ]
    },
    {
      "id": "para-005",
      "sentences": [
        {
          "id": "sent-016",
          "text": "El problema era cuál de los tres cráteres era el que mencionaba Saknussemm; el mensaje decía que la sombra de Scartaris señalaría el correcto.",
          "translationRu": "Проблема состояла в том, какой из трёх кратеров упоминал Сакнуссем; послание гласило, что тень Скартариса укажет верный."
        },
        {
          "id": "sent-017",
          "text": "Esperaron tres días en la cumbre mientras el cielo permanecía nublado, impidiendo que se proyectara sombra alguna sobre los cráteres.",
          "translationRu": "Они провели три дня на вершине, пока небо оставалось пасмурным, не позволяя ни одной тени упасть на кратеры."
        },
        {
          "id": "sent-018",
          "text": "Al cuarto día, el sol de mediodía apareció entre las nubes y la sombra puntiaguda del pico Scartaris se deslizó lentamente sobre el cráter central.",
          "translationRu": "На четвёртый день полуденное солнце появилось из-за туч, и остроконечная тень пика Скартарис медленно скользнула на центральный кратер."
        },
        {
          "id": "sent-019",
          "text": "El profesor extendió los brazos hacia el abismo oscuro y gritó triunfalmente: «¡Adelante, el camino está señalado! ¡Saknussemm no mentía!».",
          "translationRu": "Профессор протянул руки к тёмной бездне и торжествующе воскликнул: «Вперёд, путь указан! Сакнуссем не лгал!»"
        },
        {
          "id": "sent-020",
          "text": "Con el corazón acelerado, los tres viajeros se asomaron al borde del cráter y comenzaron a descender hacia las profundidades desconocidas de la Tierra.",
          "translationRu": "С бьющимся сердцем все трое путешественников заглянули за край кратера и начали спуск в неведомые глубины Земли."
        },
        {
          "id": "sent-021",
          "text": "La oscuridad los engulló poco a poco, mientras la luz del día se reducía a un óvalo cada vez más pequeño muy por encima de sus cabezas.",
          "translationRu": "Тьма постепенно поглощала их, пока дневной свет не превратился в крошечный овал далеко над головой."
        }
      ]
    }
  ]
}
