{
  "schemaVersion": "1.0",
  "workId": "the-thirty-nine-steps",
  "level": "a2",
  "chapter": {
    "id": "chapter-001",
    "number": 1,
    "title": "La visita inesperada"
  },
  "paragraphs": [
    {
      "id": "para-001",
      "sentences": [
        {
          "id": "sent-001",
          "text": "Richard Hannay era un hombre de treinta y siete años que vivía en Londres.",
          "translationRu": "Ричард Ганнэй был мужчиной тридцати семи лет, живущим в Лондоне."
        },
        {
          "id": "sent-002",
          "text": "Hacía poco que había llegado de Sudáfrica, pero la vida en la ciudad le parecía aburrida.",
          "translationRu": "Он недавно прибыл из Южной Африки, но жизнь в городе казалась ему скучной."
        },
        {
          "id": "sent-003",
          "text": "Un día, al regresar a su apartamento, un hombre extraño lo detuvo.",
          "translationRu": "Однажды, возвращаясь в свою квартиру, его остановил странный незнакомец."
        },
        {
          "id": "sent-004",
          "text": "El hombre estaba muy asustado y le pidió que lo dejara entrar.",
          "translationRu": "Мужчина был очень напуган и попросил его впустить."
        }
      ]
    },
    {
      "id": "para-002",
      "sentences": [
        {
          "id": "sent-005",
          "text": "El desconocido se llamaba Franklin Scudder.",
          "translationRu": "Незнакомца звали Франклин Скаддер."
        },
        {
          "id": "sent-006",
          "text": "Era un americano que había descubierto un complot peligroso en Europa.",
          "translationRu": "Он был американцем, открывшим опасный заговор в Европе."
        },
        {
          "id": "sent-007",
          "text": "Le contó a Richard sobre una conspiración para matar al primer ministro griego, Karolides.",
          "translationRu": "Он рассказал Ричарду о заговоре убить греческого премьер-министра Каролида."
        },
        {
          "id": "sent-008",
          "text": "Scudder dijo que sus enemigos lo buscaban para silenciarlo.",
          "translationRu": "Скаддер сказал, что его враги ищут его, чтобы заставить его молчать."
        }
      ]
    },
    {
      "id": "para-003",
      "sentences": [
        {
          "id": "sent-009",
          "text": "Richard permitió que Scudder se quedara en su apartamento.",
          "translationRu": "Ричард позволил Скаддеру остаться в его квартире."
        },
        {
          "id": "sent-010",
          "text": "Pasaron varios días sin problemas, pero Scudder estaba cada vez más nervioso.",
          "translationRu": "Прошло несколько дней без проблем, но Скаддер становился всё более нервным."
        },
        {
          "id": "sent-011",
          "text": "Una noche, Richard regresó a su apartamento muy tarde.",
          "translationRu": "Однажды ночью Ричард вернулся в свою квартиру очень поздно."
        },
        {
          "id": "sent-012",
          "text": "Encontró a Scudder muerto en el piso, con un cuchillo en el corazón.",
          "translationRu": "Он нашёл Скаддера мёртвым на полу с ножом в сердце."
        }
      ]
    },
    {
      "id": "para-004",
      "sentences": [
        {
          "id": "sent-013",
          "text": "Richard comprendió que ahora también estaba en peligro.",
          "translationRu": "Ричард понял, что теперь он тоже в опасности."
        },
        {
          "id": "sent-014",
          "text": "Los asesinos de Scudder sabían que había pasado días en su apartamento.",
          "translationRu": "Убийцы Скаддера знали, что он провёл несколько дней в его квартире."
        },
        {
          "id": "sent-015",
          "text": "Decidió escapar de Londres lo más rápido posible.",
          "translationRu": "Он решил бежать из Лондона как можно быстрее."
        },
        {
          "id": "sent-016",
          "text": "Encontró un pequeño cuaderno negro en el bolsillo de Scudder con notas misteriosas.",
          "translationRu": "Он нашёл маленький чёрный блокнот в кармане Скаддера с таинственными записями."
        }
      ]
    }
  ]
}
