{"schemaVersion":"1.0","workId":"gullivers-travels","level":"a2","chapter":{"id":"chapter-004","number":4,"title":"Los acadmicos locos"},"paragraphs":[{"id":"para-001","sentences":[{"id":"sent-001","text":"Visité una academia muy extraña en la ciudad de Lagado.","translationRu":"Я посетил очень странную академию в городе Лагадо."},{"id":"sent-002","text":"Los académicos intentaban cosas imposibles.","translationRu":"Учёные пытались делать невозможные вещи."},{"id":"sent-003","text":"Querían extraer luz del sol de los pepinos.","translationRu":"Они хотели извлечь солнечный свет из огурцов."}]},{"id":"para-002","sentences":[{"id":"sent-004","text":"Un académico estudiaba cómo construir casas desde el techo hacia abajo.","translationRu":"Один учёный изучал, как строить дома с крыши вниз."},{"id":"sent-005","text":"Otro intentaba convertir la nieve en hielo.","translationRu":"Другой пытался превращать снег в лёд."},{"id":"sent-006","text":"Nada funcionaba bien.","translationRu":"Ничего не работало хорошо."},{"id":"sent-007","text":"Pero ellos seguían intentando.","translationRu":"Но они продолжали пытаться."} ]},{"id":"para-003","sentences":[{"id":"sent-008","text":"El académico más famoso tenía una máquina muy complicada.","translationRu":"Самый знаменитый учёный имел очень сложную машину."},{"id":"sent-009","text":"Con la máquina podían escribir libros sin pensar.","translationRu":"С помощью машины они могли писать книги, не думая."},{"id":"sent-010","text":"Solo giraban una rueda y salían las palabras.","translationRu":"Они просто крутили колесо, и выходили слова."}]},{"id":"para-004","sentences":[{"id":"sent-011","text":"También vi un proyecto para cambiar el lenguaje.","translationRu":"Я также видел проект по изменению языка."},{"id":"sent-012","text":"Los académicos querían que la gente llevara cosas en lugar de hablar.","translationRu":"Учёные хотели, чтобы люди носили предметы вместо разговора."},{"id":"sent-013","text":"Así no se cansarían los pulmones.","translationRu":"Так лёгкие не устанут."},{"id":"sent-014","text":"Era una idea absurda.","translationRu":"Это была абсурдная идея."}]},{"id":"para-005","sentences":[{"id":"sent-015","text":"Finalmente dejé la academia.","translationRu":"Наконец я ушёл из академии."},{"id":"sent-016","text":"Estaba cansado de ver tantas ideas locas.","translationRu":"Я устал видеть столько сумасшедших идей."},{"id":"sent-017","text":"Decidí volver al barco y seguir viajando.","translationRu":"Я решил вернуться на корабль и продолжить путешествие."} ]}]}
