{
  "schemaVersion": "1.0",
  "workId": "the-circular-staircase",
  "level": "b1",
  "chapter": {
    "id": "chapter-005",
    "number": 5,
    "title": "El cuarto secreto"
  },
  "paragraphs": [
    {
      "id": "para-001",
      "sentences": [
        {
          "id": "sent-001",
          "text": "Miss Innes pasaba el día pensando en la casa y sus secretos.",
          "translationRu": "Мисс Иннес проводила день, думая о доме и его секретах."
        },
        {
          "id": "sent-002",
          "text": "Había un cuarto oculto detrás de la chimenea de la casa.",
          "translationRu": "Была скрытая комната позади камина дома."
        },
        {
          "id": "sent-003",
          "text": "El detective Jamieson creía que allí estaban los dineros robados del banco.",
          "translationRu": "Детектив Джеймсон думал, что там находились деньги, украденные из банка."
        },
        {
          "id": "sent-004",
          "text": "Miss Innes decidió investigar por sí misma.",
          "translationRu": "Мисс Иннес решила провести расследование самостоятельно."
        }
      ]
    },
    {
      "id": "para-002",
      "sentences": [
        {
          "id": "sent-005",
          "text": "Encontró un panel tallado en la chimenea de la habitación de arriba.",
          "translationRu": "Она нашла резную панель на камине в комнате наверху."
        },
        {
          "id": "sent-006",
          "text": "Presionó un pequeño botón de latón y la puerta se abrió.",
          "translationRu": "Она нажала на маленькую латунную кнопку, и дверь открылась."
        },
        {
          "id": "sent-007",
          "text": "Entró a un cuarto pequeño y oscuro.",
          "translationRu": "Она вошла в небольшую тёмную комнату."
        },
        {
          "id": "sent-008",
          "text": "La puerta se cerró detrás de ella con un clic.",
          "translationRu": "Дверь закрылась позади неё с щелчком."
        }
      ]
    },
    {
      "id": "para-003",
      "sentences": [
        {
          "id": "sent-009",
          "text": "Miss Innes quedó atrapada en la oscuridad absoluta.",
          "translationRu": "Мисс Иннес оказалась в полной темноте."
        },
        {
          "id": "sent-010",
          "text": "No había manija por dentro para abrir la puerta.",
          "translationRu": "Не было ручки внутри, чтобы открыть дверь."
        },
        {
          "id": "sent-011",
          "text": "Pasaron horas esperando ser rescatada.",
          "translationRu": "Прошли часы в ожидании спасения."
        },
        {
          "id": "sent-012",
          "text": "Escuchaba ruidos fuera, pasos de gente que la buscaba.",
          "translationRu": "Она слышала шумы снаружи, шаги людей, которые её ищут."
        }
      ]
    },
    {
      "id": "para-004",
      "sentences": [
        {
          "id": "sent-013",
          "text": "Finalmente, la puerta de la chimenea se abrió desde adentro.",
          "translationRu": "Наконец дверь камина открылась изнутри."
        },
        {
          "id": "sent-014",
          "text": "Un hombre intrusor estaba buscando algo en el cuarto secreto.",
          "translationRu": "Неизвестный мужчина искал что-то в скрытой комнате."
        },
        {
          "id": "sent-015",
          "text": "Miss Innes gritó cuando lo tocó en la oscuridad.",
          "translationRu": "Мисс Иннес закричала, когда коснулась его в темноте."
        },
        {
          "id": "sent-016",
          "text": "El hombre huyó cuando escuchó que la policía venía.",
          "translationRu": "Мужчина убежал, когда услышал, что идёт полиция."
        }
      ]
    },
    {
      "id": "para-005",
      "sentences": [
        {
          "id": "sent-017",
          "text": "En el cuarto secreto hallaron una caja fuerte pequeña.",
          "translationRu": "В скрытой комнате они нашли небольшой сейф."
        },
        {
          "id": "sent-018",
          "text": "Dentro estaban los documentos robados del banco.",
          "translationRu": "Внутри находились украденные документы банка."
        },
        {
          "id": "sent-019",
          "text": "Paul Armstrong, el presidente del banco, había desaparecido con el dinero.",
          "translationRu": "Пол Армстронг, президент банка, исчез с деньгами."
        },
        {
          "id": "sent-020",
          "text": "Finalmente, todos los misterios de Sunnyside fueron revelados.",
          "translationRu": "Наконец, все тайны Саннисайда были раскрыты."
        }
      ]
    }
  ]
}
