{
  "schemaVersion": "1.0",
  "workId": "the-warlord-of-mars",
  "level": "b1",
  "chapter": {
    "id": "chapter-005",
    "number": 5,
    "title": "La victoria final"
  },
  "paragraphs": [
    {
      "id": "para-001",
      "sentences": [
        {
          "id": "sent-001",
          "text": "Llegué a la ciudad de Kaol y conocí al príncipe Talu, que era un aliado valioso.",
          "translationRu": "Я прибыл в город Каол и познакомился с принцем Талу, который был ценным союзником."
        },
        {
          "id": "sent-002",
          "text": "Me ayudó a disfrazarme como un hombre amarillo para entrar en la ciudad de Kadabra.",
          "translationRu": "Он помог мне переодеться жёлтым человеком, чтобы войти в город Кадабра."
        },
        {
          "id": "sent-003",
          "text": "El dador me dio un anillo mágico que podía detectar amigos.",
          "translationRu": "Принц дал мне волшебное кольцо, которое могло обнаруживать друзей."
        },
        {
          "id": "sent-004",
          "text": "Conocí a Salensus Oll, el gobernante tirano del norte.",
          "translationRu": "Я встретил Салензуса Олла, тиранического правителя севера."
        },
        {
          "id": "sent-005",
          "text": "Este malvado deseaba hacer su esposa a mi amada Dejah Thoris.",
          "translationRu": "Этот злодей хотел сделать мою любимую Деджа Торис своей женой."
        }
      ]
    },
    {
      "id": "para-002",
      "sentences": [
        {
          "id": "sent-006",
          "text": "Descubrí a Dejah Thoris prisionera en el palacio de Salensus Oll.",
          "translationRu": "Я обнаружил Деджа Торис в плену во дворце Салензуса Олла."
        },
        {
          "id": "sent-007",
          "text": "Fue arrojado al Pozo de Abundancia, un castigo terrible.",
          "translationRu": "Меня бросили в Яму Изобилия, ужасную кару."
        },
        {
          "id": "sent-008",
          "text": "Allí sufrí hambre y sed durante días terribles.",
          "translationRu": "Там я страдал от голода и жажды в течение ужасных дней."
        },
        {
          "id": "sent-009",
          "text": "Pero un amigo secreto me envió un mensaje con comida concentrada.",
          "translationRu": "Но один тайный друг прислал мне сообщение с концентрированной пищей."
        },
        {
          "id": "sent-010",
          "text": "El mensaje me mostró el camino de escape usando una cuerda.",
          "translationRu": "Сообщение показало мне путь спасения, используя верёвку."
        }
      ]
    },
    {
      "id": "para-003",
      "sentences": [
        {
          "id": "sent-011",
          "text": "Escapé del pozo y encontré a los guardias en el palacio.",
          "translationRu": "Я выбежал из ямы и встретил стражей во дворце."
        },
        {
          "id": "sent-012",
          "text": "Liberé a Tardos Mors, mi abuelo de Dejah Thoris, del cautiverio.",
          "translationRu": "Я освободил Тардоса Морса, деда Деджа Торис, из неволи."
        },
        {
          "id": "sent-013",
          "text": "Los hombres rojos de Helium atacaron el palacio desde afuera.",
          "translationRu": "Красные люди Гелиума атаковали дворец снаружи."
        },
        {
          "id": "sent-014",
          "text": "Mi hijo Carthoris lideraba una parte del ejército de Helium.",
          "translationRu": "Мой сын Картхорис возглавлял часть армии Гелиума."
        },
        {
          "id": "sent-015",
          "text": "Los hombres verdes de Thark también llegaron para ayudarnos.",
          "translationRu": "Зелёные люди Тарка также прибыли, чтобы помочь нам."
        }
      ]
    },
    {
      "id": "para-004",
      "sentences": [
        {
          "id": "sent-016",
          "text": "Juntos vencimos al tirano Salensus Oll en una batalla épica.",
          "translationRu": "Мы вместе победили тирана Салензуса Олла в эпической битве."
        },
        {
          "id": "sent-017",
          "text": "Rescaté a Dejah Thoris de las manos del malvado Thurid.",
          "translationRu": "Я спас Деджа Торис из рук злого Туридома."
        },
        {
          "id": "sent-018",
          "text": "Incluso Phaidor, la enemiga, me ayudó al final y se sacrificó.",
          "translationRu": "Даже враг Фаидор помогла мне в конце и пожертвовала собой."
        },
        {
          "id": "sent-019",
          "text": "Mi familia fue reunida después de doce años de sufrimiento.",
          "translationRu": "Моя семья была воссоединена после двенадцати лет страданий."
        },
        {
          "id": "sent-020",
          "text": "Fui nombrado Warlord de Barsoom, el gobernante más poderoso del planeta.",
          "translationRu": "Я был назван Вожаком войны Барсума, самым могущественным правителем планеты."
        }
      ]
    }
  ]
}
