{
  "schemaVersion": "1.0",
  "workId": "the-worst-crime-in-the-world",
  "level": "b1",
  "chapter": {
    "id": "chapter-001",
    "number": 1,
    "title": "El peor crimen del mundo"
  },
  "paragraphs": [
    {
      "id": "para-001",
      "sentences": [
        {
          "id": "sent-001",
          "text": "El padre Brown caminaba por una galería de arte moderna con aire distraído.",
          "translationRu": "Отец Браун рассеянно прогуливался по современной художественной галерее."
        },
        {
          "id": "sent-002",
          "text": "No había venido a mirar los cuadros, sino a buscar a su sobrina Betty.",
          "translationRu": "Он пришёл не смотреть на картины, а разыскивать свою племянницу Бетти."
        },
        {
          "id": "sent-003",
          "text": "Betty era hija de la hermana del sacerdote, y él era su protector y guardián.",
          "translationRu": "Бетти была дочерью сестры священника, и он был её защитником и опекуном."
        }
      ]
    },
    {
      "id": "para-002",
      "sentences": [
        {
          "id": "sent-004",
          "text": "Entre los visitantes, el padre Brown notó a un joven elegante con barba y el pelo muy corto.",
          "translationRu": "Среди посетителей отец Браун заметил элегантного молодого человека с бородой и коротко стриженными волосами."
        },
        {
          "id": "sent-005",
          "text": "También había una mujer imponente vestida de rojo, con el pelo amarillo y una mirada dominante.",
          "translationRu": "Там же была властная женщина в красном, с жёлтыми волосами и властным взглядом."
        },
        {
          "id": "sent-006",
          "text": "Detrás de ella iba un hombre bajito con barba grande.",
          "translationRu": "За ней следовал низкорослый мужчина с большой бородой."
        }
      ]
    },
    {
      "id": "para-003",
      "sentences": [
        {
          "id": "sent-007",
          "text": "En ese momento llegó el abogado Granby, que buscaba al capitán James Musgrave.",
          "translationRu": "В этот момент появился адвокат Грэнби, разыскивавший капитана Джеймса Масгрейва."
        },
        {
          "id": "sent-008",
          "text": "El capitán quería que la firma de Granby le prestara dinero sobre la herencia de su padre.",
          "translationRu": "Капитан хотел, чтобы фирма Грэнби одолжила ему деньги под наследство отца."
        },
        {
          "id": "sent-009",
          "text": "El padre era Sir John Musgrave, un viejo baronet que vivía en un castillo medieval en el norte.",
          "translationRu": "Отцом был сэр Джон Масгрейв — старый баронет, живший в средневековом замке на севере."
        }
      ]
    },
    {
      "id": "para-004",
      "sentences": [
        {
          "id": "sent-010",
          "text": "Betty llegó y llevó a su tío aparte.",
          "translationRu": "Бетти появилась и отвела дядю в сторону."
        },
        {
          "id": "sent-011",
          "text": "Le contó que oyó al capitán Musgrave reír solo, mirando al techo.",
          "translationRu": "Она рассказала, что слышала, как капитан Масгрейв смеялся в одиночестве, глядя в потолок."
        },
        {
          "id": "sent-012",
          "text": "Era una risa extraña que le heló la sangre.",
          "translationRu": "Это был странный смех, от которого у неё кровь застыла в жилах."
        },
        {
          "id": "sent-013",
          "text": "Su madre quería que se casara con el capitán por su dinero y su posición.",
          "translationRu": "Её мать хотела, чтобы она вышла замуж за капитана ради его денег и положения."
        }
      ]
    },
    {
      "id": "para-005",
      "sentences": [
        {
          "id": "sent-014",
          "text": "El capitán Musgrave invitó a Granby a visitar el castillo de su padre al día siguiente.",
          "translationRu": "Капитан Масгрейв пригласил Грэнби на следующий день посетить замок своего отца."
        },
        {
          "id": "sent-015",
          "text": "Pero cuando vio a la mujer de rojo, cambió de planes y dijo que tenía que quedarse en Londres.",
          "translationRu": "Но увидев женщину в красном, он изменил планы и сказал, что должен остаться в Лондоне."
        },
        {
          "id": "sent-016",
          "text": "El padre Brown y Granby viajaron solos al norte en el coche del capitán.",
          "translationRu": "Отец Браун и Грэнби отправились на север одни, в машине капитана."
        }
      ]
    },
    {
      "id": "para-006",
      "sentences": [
        {
          "id": "sent-017",
          "text": "El castillo de Musgrave Moss tenía foso, puente levadizo y rastrillo.",
          "translationRu": "Замок Масгрейв-Мосс имел ров, подъёмный мост и решётку."
        },
        {
          "id": "sent-018",
          "text": "El puente levadizo estaba atascado, y Granby tuvo que saltar sobre el foso.",
          "translationRu": "Подъёмный мост застрял, и Грэнби пришлось перепрыгнуть через ров."
        },
        {
          "id": "sent-019",
          "text": "El padre Brown casi cayó al agua, pero vio algo en la orilla: marcas profundas de dos pies.",
          "translationRu": "Отец Браун едва не упал в воду, но заметил на берегу кое-что: глубокие следы двух ног."
        }
      ]
    },
    {
      "id": "para-007",
      "sentences": [
        {
          "id": "sent-020",
          "text": "El baronet los recibió con cortesía y dijo que dejaría toda su fortuna a su hijo.",
          "translationRu": "Баронет принял их учтиво и сказал, что оставит всё состояние сыну."
        },
        {
          "id": "sent-021",
          "text": "Pero también declaró que nunca volvería a hablar con él.",
          "translationRu": "Но также заявил, что никогда больше не заговорит с ним."
        },
        {
          "id": "sent-022",
          "text": "Su hijo había cometido el peor crimen del mundo, como matar a un invitado o traicionar la confianza de la familia.",
          "translationRu": "Его сын совершил худшее преступление в мире — всё равно что убить гостя или предать доверие семьи."
        }
      ]
    },
    {
      "id": "para-008",
      "sentences": [
        {
          "id": "sent-023",
          "text": "El padre Brown se quedó en el pueblo cercano para investigar.",
          "translationRu": "Отец Браун остался в соседней деревне, чтобы вести расследование."
        },
        {
          "id": "sent-024",
          "text": "Al día siguiente vio al baronet caminar por el pueblo y hablar con él.",
          "translationRu": "На следующий день он увидел, как баронет прогуливается по деревне, и поговорил с ним."
        },
        {
          "id": "sent-025",
          "text": "El viejo baronet dijo que su hijo había huido del país y que unos rusos llamados Grunov lo buscaban.",
          "translationRu": "Старый баронет сказал, что его сын бежал из страны, и что какие-то русские по фамилии Грунов его разыскивают."
        },
        {
          "id": "sent-026",
          "text": "También dijo que el día anterior no había llegado a tiempo a la oficina de correos.",
          "translationRu": "Он также сказал, что накануне не успел к закрытию почты."
        }
      ]
    },
    {
      "id": "para-009",
      "sentences": [
        {
          "id": "sent-027",
          "text": "El padre Brown recordó que había una sola armadura en la sala, cuando debían ser dos.",
          "translationRu": "Отец Браун вспомнил, что в зале стояли одни доспехи, хотя должно было быть двое."
        },
        {
          "id": "sent-028",
          "text": "Todo lo demás en la sala estaba en pares: las hachas, los escudos.",
          "translationRu": "Всё остальное в зале было попарно: топоры, щиты."
        },
        {
          "id": "sent-029",
          "text": "Y comprendió la verdad: el capitán había matado a su padre.",
          "translationRu": "И он понял правду: капитан убил своего отца."
        },
        {
          "id": "sent-030",
          "text": "Escondió el cuerpo en la segunda armadura y después lo arrojó al foso.",
          "translationRu": "Он спрятал тело во вторых доспехах, а затем бросил его в ров."
        }
      ]
    },
    {
      "id": "para-010",
      "sentences": [
        {
          "id": "sent-031",
          "text": "Luego el capitán se afeitó, se puso la peluca de su padre y se disfrazó de él.",
          "translationRu": "Затем капитан побрился, надел парик отца и загримировался под него."
        },
        {
          "id": "sent-032",
          "text": "Los dos se parecían mucho, como se podía ver en los retratos de la familia.",
          "translationRu": "Они были очень похожи, как видно было из семейных портретов."
        },
        {
          "id": "sent-033",
          "text": "Cuando el padre Brown llegó al castillo, el «viejo baronet» había saltado el foso porque el puente estaba bloqueado.",
          "translationRu": "Когда отец Браун прибыл в замок, «старый баронет» перепрыгнул ров, потому что мост был заблокирован."
        },
        {
          "id": "sent-034",
          "text": "Un hombre de casi ochenta años no puede saltar así: era el capitán disfrazado.",
          "translationRu": "Человек почти восьмидесяти лет так прыгать не может — это был переодетый капитан."
        },
        {
          "id": "sent-035",
          "text": "El plan era perfecto: el «padre» decía que jamás hablaría con el hijo, explicando así por qué nunca se verían.",
          "translationRu": "План был совершенен: «отец» говорил, что никогда не заговорит с сыном, — это объясняло, почему они никогда не встречались."
        }
      ]
    }
  ]
}
