{
  "schemaVersion": "1.0",
  "workId": "the-gods-of-mars",
  "level": "a2",
  "chapter": {
    "id": "chapter-004",
    "number": 4,
    "title": "La fuga de la prisión"
  },
  "paragraphs": [
    {
      "id": "para-001",
      "sentences": [
        {
          "id": "sent-001",
          "text": "John Carter planeó una fuga valiente de su celda.",
          "translationRu": "Джон Картер спланировал храбрый побег из своей камеры."
        },
        {
          "id": "sent-002",
          "text": "Carthoris, su hijo desconocido, vino a rescatarlo.",
          "translationRu": "Картхорис, его неизвестный сын, пришёл спасти его."
        },
        {
          "id": "sent-003",
          "text": "John Carter quedó sorprendido de tener un hijo tan valiente.",
          "translationRu": "Джон Картер был удивлён, что у него есть такой храбрый сын."
        },
        {
          "id": "sent-004",
          "text": "Juntos escaparon por los pasillos oscuros de la prisión.",
          "translationRu": "Вместе они убежали через тёмные коридоры тюрьмы."
        },
        {
          "id": "sent-005",
          "text": "Encontraron una nave voladora escondida en el puerto subterráneo.",
          "translationRu": "Они нашли летающий корабль, спрятанный в подземном порту."
        },
        {
          "id": "sent-006",
          "text": "Con Xodar, un primer nacido que los ayudaba, volaron hacia arriba.",
          "translationRu": "С Ксодаром, первородным, который им помогал, они летели вверх."
        },
        {
          "id": "sent-007",
          "text": "El viaje hacia la superficie fue muy peligroso y oscuro.",
          "translationRu": "Путешествие на поверхность было очень опасным и тёмным."
        },
        {
          "id": "sent-008",
          "text": "Cuando salieron a la luz del día, vieron el cielo de Marte.",
          "translationRu": "Когда они вышли на свет, они увидели небо Марса."
        },
        {
          "id": "sent-009",
          "text": "Pero la nave fue dañada en la fuga y cayó a tierra.",
          "translationRu": "Но корабль был повреждён во время побега и упал на землю."
        },
        {
          "id": "sent-010",
          "text": "En los hills cerca de allí, encontraron a una amiga vieja.",
          "translationRu": "На холмах рядом они нашли старую подругу."
        },
        {
          "id": "sent-011",
          "text": "Era Thuvia, quien les contó noticias de Dejah Thoris.",
          "translationRu": "Это была Тувия, которая рассказала им новости о Деджах Торис."
        },
        {
          "id": "sent-012",
          "text": "Dejah Thoris había sido capturada por los Primogénitos también.",
          "translationRu": "Деджах Торис также была захвачена Первородными."
        },
        {
          "id": "sent-013",
          "text": "John Carter se dio cuenta de que aún tenía que rescatarla.",
          "translationRu": "Джон Картер понял, что ему всё ещё нужно её спасить."
        },
        {
          "id": "sent-014",
          "text": "Reunió a sus leales guerreros para una nueva expedición.",
          "translationRu": "Он собрал своих верных воинов для новой экспедиции."
        },
        {
          "id": "sent-015",
          "text": "Esta vez traería una flota entera para conquistar a los Primogénitos.",
          "translationRu": "На этот раз он привёл целый флот, чтобы завоевать Первородных."
        }
      ]
    }
  ]
}
